date,reference,type,title,rapporteur,committee,intra,oeil,doc
,A10-0199/2025,,"REPORT on the proposal for a Council decision on the conclusion, on behalf of the Union, of the Amending Protocol to the Agreement between the European Union and the Principality of Andorra on the automatic exchange of financial account information to improve international tax compliance",,0,,https://www.europarl.europa.eu/doceo/document/A-10-2025-0199_EN.html,
,A10-0198/2025,,"REPORT on the proposal for a Council decision on the conclusion, on behalf of the Union, of the Amending Protocol to the Agreement between the European Union and the Principality of Monaco on the exchange of financial account information to improve international tax compliance in accordance with the Standard for Automatic Exchange of Financial Account Information in Tax Matters developed by the Organisation for Economic Cooperation and Development (OECD)",,0,,https://www.europarl.europa.eu/doceo/document/A-10-2025-0198_EN.html,
,A10-0190/2025,,REPORT containing a motion for a non-legislative resolution on the proposal for a Council decision on the conclusion of the Agreement on Digital Trade between the European Union and the Republic of Singapore,,0,,https://www.europarl.europa.eu/doceo/document/A-10-2025-0190_EN.html,
,A10-0187/2025,,RECOMMENDATION on the draft Council decision on the conclusion of the Agreement on Digital Trade between the European Union and the Republic of Singapore,,0,,https://www.europarl.europa.eu/doceo/document/A-10-2025-0187_EN.html,
,A10-0231/2025,,"INTERIM REPORT on the proposal for a Council decision determining, pursuant to Article 7(1) of the Treaty on European Union, the existence of a clear risk of a serious breach by Hungary of the values on which the Union is founded",,0,,https://www.europarl.europa.eu/doceo/document/A-10-2025-0231_EN.html,
,A10-0196/2025,,REPORT on the institutional aspects of the Report on the future of European Competitiveness (Draghi Report),,0,,https://www.europarl.europa.eu/doceo/document/A-10-2025-0196_EN.html,
,A10-0084/2025,,REPORT on the proposal for a regulation of the European Parliament and of the Council establishing the European Defence Industry Programme and a framework of measures to ensure the timely availability and supply of defence products (‘EDIP’),,0,,https://www.europarl.europa.eu/doceo/document/A-10-2025-0084_EN.html,
,A10-0212/2025,,REPORT on the 2024 budget – assessing the implementation of the gender mainstreaming methodology in the EU budget,,0,,https://www.europarl.europa.eu/doceo/document/A-10-2025-0212_EN.html,
,B10-0493/2025,,"MOTION FOR A RESOLUTION on Commission Implementing Decision renewing the authorisation for the placing on the market of products containing, consisting of or produced from genetically modified soybean MON 87708, pursuant to Regulation (EC) No 1829/2003 of the European Parliament and of the Council",,0,,https://www.europarl.europa.eu/doceo/document/B-10-2025-0493_EN.html,
,B10-0492/2025,,"MOTION FOR A RESOLUTION on the draft Commission implementing decision renewing the authorisation for the placing on the market of products containing, consisting of or produced from genetically modified cotton MON 88913 (MON-88913-8), pursuant to Regulation (EC) No 1829/2003 of the European Parliament and of the Council",,0,,https://www.europarl.europa.eu/doceo/document/B-10-2025-0492_EN.html,
,B10-0491/2025,,"MOTION FOR A RESOLUTION on the draft Commission implementing decision renewing the authorisation for the placing on the market of products containing, consisting of or produced from genetically modified maize MON 87427, pursuant to Regulation No 1829/2003 of the European Parliament and of the Council",,0,,https://www.europarl.europa.eu/doceo/document/B-10-2025-0491_EN.html,
,B10-0490/2025,,"MOTION FOR A RESOLUTION on the draft Commission implementing decision renewing the authorisation for the placing on the market of products containing, consisting of or produced from genetically modified oilseed rape MON 88302, pursuant to Regulation (EC) No 1829/2003 of the European Parliament and of the Council",,0,,https://www.europarl.europa.eu/doceo/document/B-10-2025-0490_EN.html,
,B10-0489/2025,,"MOTION FOR A RESOLUTION on the draft Commission implementing decision authorising the placing on the market of products containing, consisting of or produced from genetically modified maize DAS1131, pursuant to Regulation (EC) No 1829/2003 of the European Parliament and of the Council",,0,,https://www.europarl.europa.eu/doceo/document/B-10-2025-0489_EN.html,
,A10-0234/2025,,REPORT on ensuring the faster registration and uptake of biological control agents,,0,,https://www.europarl.europa.eu/doceo/document/A-10-2025-0234_EN.html,
,A10-0225/2025,,REPORT on the impact of artificial intelligence on the financial sector,,0,,https://www.europarl.europa.eu/doceo/document/A-10-2025-0225_EN.html,
,A10-0109/2025,,"REPORT on the proposal for a regulation of the European Parliament and of the Council on enhancing police cooperation in relation to the prevention, detection and investigation of migrant smuggling and trafficking in human beings, and on enhancing Europol’s support to preventing and combating such crimes and amending Regulation (EU) 2016/794",,0,,https://www.europarl.europa.eu/doceo/document/A-10-2025-0109_EN.html,
,A10-0237/2025,,"REPORT on the Council position on Draft amending budget No 3/2025 of the European Union for the financial year 2025 - Adjustment in payment appropriations, update of revenues and other technical updates",,0,,https://www.europarl.europa.eu/doceo/document/A-10-2025-0237_EN.html,
,B10-0500/2025,,"MOTION FOR A RESOLUTION on protection of EU consumers against the practices of certain e-commerce platforms: the case of child-like sex dolls, weapons and other illegal products and materials",,0,,https://www.europarl.europa.eu/doceo/document/B-10-2025-0500_EN.html,
,A10-0213/2025,,REPORT on the protection of minors online,,0,,https://www.europarl.europa.eu/doceo/document/A-10-2025-0213_EN.html,
,A10-0229/2025,,"REPORT on a European Parliament recommendation to the Council, the Commission and the Vice-President of the Commission / High Representative of the Union for Foreign Affairs and Security Policy on the EU’s diplomatic strategy and geopolitical cooperation in the Arctic",,0,,https://www.europarl.europa.eu/doceo/document/A-10-2025-0229_EN.html,
,A10-0185/2025,,REPORT on access to finance for SMEs and scale-ups,,0,,https://www.europarl.europa.eu/doceo/document/A-10-2025-0185_EN.html,
,B10-0506/2025,,MOTION FOR A RESOLUTION on the Commission delegated regulation of 16 October 2025 amending Delegated Regulation (EU) 2023/2429 as regards origin labelling for fruit and vegetables originating in the non-self-governing territory of Western Sahara,,0,,https://www.europarl.europa.eu/doceo/document/B-10-2025-0506_EN.html,
,B10-0503/2025,,MOTION FOR A RESOLUTION on the Commission delegated regulation of 16 October 2025 amending Delegated Regulation (EU) 2023/2429 as regards origin labelling for fruit and vegetables originating in the non-self-governing territory of Western Sahara,,0,,https://www.europarl.europa.eu/doceo/document/B-10-2025-0503_EN.html,
,B10-0501/2025,,MOTION FOR A RESOLUTION on Commission delegated regulation of 3 November 2025 amending Delegated Regulation (EU) 2020/1818 as regards the definition of prohibited weapons,,0,,https://www.europarl.europa.eu/doceo/document/B-10-2025-0501_EN.html,
,B10-0499/2025,,MOTION FOR A RESOLUTION on the Commission delegated regulation of 3 November 2025 amending Delegated Regulation (EU) 2020/1818 as regards the definition of prohibited weapons,,0,,https://www.europarl.europa.eu/doceo/document/B-10-2025-0499_EN.html,
,B10-0496/2025,,"MOTION FOR A RESOLUTION on protecting EU consumers against the practices of certain e-commerce platforms: the case of child-like sex dolls, weapons and other illegal products and material",,0,,https://www.europarl.europa.eu/doceo/document/B-10-2025-0496_EN.html,
,A10-0235/2025,,REPORT on the joint text on the draft general budget of the European Union for the financial year 2026 approved by the Conciliation Committee under the budgetary procedure,,0,,https://www.europarl.europa.eu/doceo/document/A-10-2025-0235_EN.html,
,A10-0222/2025,,REPORT on the draft Council regulation amending Regulation (EC) No 2533/98 concerning the collection of statistical information by the European Central Bank (ECB/2025/17),,0,,https://www.europarl.europa.eu/doceo/document/A-10-2025-0222_EN.html,
,A10-0117/2025,,"REPORT on the proposal for a regulation of the European Parliament and of the Council amending Regulations (EU) 2015/1017, (EU) 2021/523, (EU) 2021/695 and (EU) 2021/1153 as regards increasing the efficiency of the EU guarantee under Regulation (EU) 2021/523 and simplifying reporting requirements",,0,,https://www.europarl.europa.eu/doceo/document/A-10-2025-0117_EN.html,
,RC-B10-0533/2025,,JOINT MOTION FOR A RESOLUTION on the escalation of the war and the humanitarian catastrophe in Sudan,,0,,https://www.europarl.europa.eu/doceo/document/RC-10-2025-0533_EN.html,
,A10-0226/2025,,REPORT on the implementation of the EU-UK Trade and Cooperation Agreement,,0,,https://www.europarl.europa.eu/doceo/document/A-10-2025-0226_EN.html,
,A10-0211/2025,,REPORT on the EU strategy for the rights of persons with disabilities post-2024,,0,,https://www.europarl.europa.eu/doceo/document/A-10-2025-0211_EN.html,
,RC-B10-0545/2025,,JOINT MOTION FOR A RESOLUTION on the EU position on the proposed plan and EU engagement towards a just and lasting peace for Ukraine,,0,,https://www.europarl.europa.eu/doceo/document/RC-10-2025-0545_EN.html,
,RC-B10-0528/2025,,JOINT MOTION FOR A RESOLUTION on the escalating repression of the Baha’is in Iran,,0,,https://www.europarl.europa.eu/doceo/document/RC-10-2025-0528_EN.html,
,RC-B10-0518/2025,,"JOINT MOTION FOR A RESOLUTION on the rule of law and human rights situation in Tunisia, particularly the case of Sonia Dahmani",,0,,https://www.europarl.europa.eu/doceo/document/RC-10-2025-0518_EN.html,
,RC-B10-0508/2025,,JOINT MOTION FOR A RESOLUTION on the political situation in Myanmar including the humanitarian crisis of the Rohingya,,0,,https://www.europarl.europa.eu/doceo/document/RC-10-2025-0508_EN.html,
,A10-0224/2025,,REPORT on the application of the Treaty provisions related to the principles of subsidiarity and proportionality and the role of national parliaments in the EU legislative process,,0,,https://www.europarl.europa.eu/doceo/document/A-10-2025-0224_EN.html,
,A10-0208/2025,,REPORT on the proposal for a directive of the European Parliament and of the Council establishing harmonised requirements in the internal market on transparency of interest representation carried out on behalf of third countries and amending Directive (EU) 2019/1937,,0,,https://www.europarl.europa.eu/doceo/document/A-10-2025-0208_EN.html,
,RC-B10-0514/2025,,"JOINT MOTION FOR A RESOLUTION on the post-election killings and deteriorating human rights situation in Tanzania, including the case of imprisoned opposition leader Tundu Lissu",,0,,https://www.europarl.europa.eu/doceo/document/RC-10-2025-0514_EN.html,
,A10-0209/2025,,REPORT on the proposal for a regulation of the European Parliament and of the Council amending Regulations (EU) No 1024/2012 and (EU) 2018/1724 as regards certain requirements laid down by Directive (EU) XXXX/XXXX,,0,,https://www.europarl.europa.eu/doceo/document/A-10-2025-0209_EN.html,
,A10-0254/2025,,REPORT on the proposal for a regulation of the European Parliament and of the Council implementing the bilateral safeguard clause of the EU-Mercosur Partnership Agreement and the EU-Mercosur Interim Trade Agreement for agricultural products,,0,,https://www.europarl.europa.eu/doceo/document/A-10-2025-0254_EN.html,
,A10-0230/2025,,REPORT on relations between the EU and Saudi Arabia,,0,,https://www.europarl.europa.eu/doceo/document/A-10-2025-0230_EN.html,
,A10-0246/2025,,RECOMMENDATION FOR SECOND READING on the Council position at first reading with a view to the adoption of a regulation of the European Parliament and of the Council on compulsory licensing for crisis management and amending Regulation (EC) No 816/2006,,0,,https://www.europarl.europa.eu/doceo/document/A-10-2025-0246_EN.html,
,A10-0239/2025,,REPORT on the proposal for a decision of the European Parliament and of the Council on the mobilisation of the European Globalisation Adjustment Fund for Displaced Workers following an application from Sweden – EGF/2025/003 SE/Northvolt,,0,,https://www.europarl.europa.eu/doceo/document/A-10-2025-0239_EN.html,
,B10-0562/2025,,"MOTION FOR A RESOLUTION on the draft Commission Implementing Decision of renewing the authorisation for the placing on the market of products containing, consisting of or produced from genetically modified maize NK603 pursuant to Regulation (EC) No 1829/2003 of the European Parliament and of the Council",,0,,https://www.europarl.europa.eu/doceo/document/B-10-2025-0562_EN.html,
,B10-0559/2025,,"MOTION FOR A RESOLUTION on the draft Commission Implementing Decision authorising the placing on the market of food, food ingredients and feed produced from genetically modified sugar beet KWS20-1 pursuant to Regulation (EC) No 1829/2003 of the European Parliament and of the Council",,0,,https://www.europarl.europa.eu/doceo/document/B-10-2025-0559_EN.html,
,A10-0249/2025,,"RECOMMENDATION FOR SECOND READING on the Council position at first reading with a view to the adoption of a directive of the European Parliament and of the Council amending Directive 2013/11/EU on alternative dispute resolution for consumer disputes and amending Directives (EU) 2015/2302, (EU) 2019/2161 and (EU) 2020/1828 following the discontinuation of the European Online Dispute Resolution Platform",,0,,https://www.europarl.europa.eu/doceo/document/A-10-2025-0249_EN.html,
,A10-0245/2025,,REPORT on the proposal for a decision of the European Parliament and of the Council on providing macro-financial assistance to the Hashemite Kingdom of Jordan,,0,,https://www.europarl.europa.eu/doceo/document/A-10-2025-0245_EN.html,
,A10-0233/2025,,REPORT on the proposal for a regulation of the European Parliament and of the Council amending Regulation (EU) 2021/1755 as regards the amounts allocated to the Member States under the Brexit Adjustment Reserve,,0,,https://www.europarl.europa.eu/doceo/document/A-10-2025-0233_EN.html,
,A10-0172/2025,,"REPORT on the proposal for a regulation of the European Parliament and of the Council amending Regulations (EU) 2021/694, (EU) 2021/695, (EU) 2021/697, (EU) 2021/1153, (EU) 2023/1525 and 2024/795, as regards incentivising defence-related investments in the EU budget to implement the ReArm Europe Plan",,0,,https://www.europarl.europa.eu/doceo/document/A-10-2025-0172_EN.html,
,B10-0558/2025,,"MOTION FOR A RESOLUTION on the European citizens’ initiative entitled ‘My Voice, My Choice: For Safe and Accessible Abortion’",,0,,https://www.europarl.europa.eu/doceo/document/B-10-2025-0558_EN.html,
,A10-0244/2025,,"REPORT with recommendations to the Commission on digitalisation, artificial intelligence and algorithmic management in the workplace – shaping the future of work",,0,,https://www.europarl.europa.eu/doceo/document/A-10-2025-0244_EN.html,
,A10-0243/2025,,REPORT on European Defence Readiness 2030: assessment of needs,,0,,https://www.europarl.europa.eu/doceo/document/A-10-2025-0243_EN.html,
,A10-0195/2025,,"REPORT on the proposal for a regulation of the European Parliament and of the Council on phasing out Russian natural gas imports, improving monitoring of potential energy dependencies and amending Regulation (EU) 2017/1938",,0,,https://www.europarl.europa.eu/doceo/document/A-10-2025-0195_EN.html,
,B10-0566/2025,,MOTION FOR A RESOLUTION on the Commission delegated regulation of 4 July 2025 amending Commission Delegated Regulation (EU) 2021/2178 as regards the simplification of the content and presentation of information to be disclosed concerning environmentally sustainable activities and Commission Delegated Regulations (EU) 2021/2139 and (EU) 2023/2486 as regards simplification of certain technical screening criteria for determining whether economic activities cause no significant harm to environmental objectives,,0,,https://www.europarl.europa.eu/doceo/document/B-10-2025-0566_EN.html,
,B10-0557/2025,,"MOTION FOR A RESOLUTION on the European citizens’ initiative entitled ‘My Voice, My Choice: For Safe and Accessible Abortion’",,0,,https://www.europarl.europa.eu/doceo/document/B-10-2025-0557_EN.html,
,A10-0259/2025,,REPORT on the proposal for a regulation of the European Parliament and of the Council amending Regulation (EU) 2024/1348 as regards the establishment of a list of safe countries of origin at Union level,,0,,https://www.europarl.europa.eu/doceo/document/A-10-2025-0259_EN.html,
,A10-0255/2025,,REPORT on the proposal for a regulation of the European Parliament and of the Council amending Regulation (EU) 2024/1348 as regards the application of the ‘safe third country’ concept,,0,,https://www.europarl.europa.eu/doceo/document/A-10-2025-0255_EN.html,
,A10-0242/2025,,REPORT on military mobility,,0,,https://www.europarl.europa.eu/doceo/document/A-10-2025-0242_EN.html,
,A10-0241/2025,,REPORT on the proposal for a Council regulation on amending Council Regulation (EU) 2021/1173 of 13 July 2021 on establishing the European High Performance Computing Joint Undertaking and repealing Regulation (EU) 2018/1488,,0,,https://www.europarl.europa.eu/doceo/document/A-10-2025-0241_EN.html,
,A10-0228/2025,,"RECOMMENDATION on the draft Council decision on the conclusion of the Agreement, in the form of an Exchange of Letters, amending and supplementing the Agreement for scientific and technological cooperation between the European Union and the Hashemite Kingdom of Jordan, setting out the terms and conditions for the participation of the Hashemite Kingdom of Jordan in the Partnership for Research and Innovation in the Mediterranean Area (PRIMA)",,0,,https://www.europarl.europa.eu/doceo/document/A-10-2025-0228_EN.html,
,A10-0240/2025,,REPORT on the implementation of the rule of law conditionality regime,,0,,https://www.europarl.europa.eu/doceo/document/A-10-2025-0240_EN.html,
,RC-B10-0571/2025,,JOINT MOTION FOR A RESOLUTION on the continuous Belarusian hybrid attacks against Lithuania,,0,,https://www.europarl.europa.eu/doceo/document/RC-10-2025-0571_EN.html,
,A10-0236/2025,,"REPORT on the decarbonisation and modernisation of EU fisheries, and the development and deployment of fishing gear",,0,,https://www.europarl.europa.eu/doceo/document/A-10-2025-0236_EN.html,
,RC-B10-0577/2025,,"JOINT MOTION FOR A RESOLUTION on the mass kidnapping of children in Nigeria, including from St Mary’s Catholic School in Papiri",,0,,https://www.europarl.europa.eu/doceo/document/RC-10-2025-0577_EN.html,
,RC-B10-0567/2025,,JOINT MOTION FOR A RESOLUTION on the arbitrary arrest and sentencing of academics Bahruz Samadov and Igbal Abilov in Azerbaijan,,0,,https://www.europarl.europa.eu/doceo/document/RC-10-2025-0567_EN.html,
,RC-B10-0568/2025,,JOINT MOTION FOR A RESOLUTION on the grave political situation in Guinea-Bissau after the coup of 26 November,,0,,https://www.europarl.europa.eu/doceo/document/RC-10-2025-0568_EN.html,
,A10-0269/2025,,REPORT with recommendations to the Commission on the 28th Regime: a new legal framework for innovative companies,,0,,https://www.europarl.europa.eu/doceo/document/A-10-2025-0269_EN.html,
,A10-0272/2025,,"REPORT on the proposal for a regulation of the European Parliament and of the Council laying a framework for strengthening the availability and security of supply of critical medicinal products as well as the availability of, and accessibility of, medicinal products of common interest, and amending Regulation (EU) 2024/795",,0,,https://www.europarl.europa.eu/doceo/document/A-10-2025-0272_EN.html,
,A10-0252/2025,,REPORT on the reform of the European Electoral Act – hurdles to ratification and implementation in the Member States,,0,,https://www.europarl.europa.eu/doceo/document/A-10-2025-0252_EN.html,
,B10-0057/2026,,MOTION FOR A RESOLUTION on the murder of Mehdi Kessaci: urgent need for ambitious European action against drug trafficking,,0,,https://www.europarl.europa.eu/doceo/document/B-10-2026-0057_EN.html,
,A10-0261/2025,,REPORT with recommendations to the Commission on just transition directive in the world of work: ensuring the creation of jobs and revitalising local economies,,0,,https://www.europarl.europa.eu/doceo/document/A-10-2025-0261_EN.html,
,A10-0257/2025,,REPORT on humanitarian aid in a time of polycrisis – reaffirming our principles for a more effective and ambitious response to humanitarian crises,,0,,https://www.europarl.europa.eu/doceo/document/A-10-2025-0257_EN.html,
,A10-0232/2025,,REPORT on safeguarding and promoting financial stability amid economic uncertainties,,0,,https://www.europarl.europa.eu/doceo/document/A-10-2025-0232_EN.html,
,A10-0253/2025,,REPORT on the implementation of the common foreign and security policy – annual report 2025,,0,,https://www.europarl.europa.eu/doceo/document/A-10-2025-0253_EN.html,
,A10-0262/2025,,REPORT on human rights and democracy in the world and the European Union’s policy on the matter – annual report 2025,,0,,https://www.europarl.europa.eu/doceo/document/A-10-2025-0262_EN.html,
,A10-0265/2025,,REPORT on the implementation of the common security and defence policy – annual report 2025,,0,,https://www.europarl.europa.eu/doceo/document/A-10-2025-0265_EN.html,
,B10-0061/2026,,"MOTION FOR A RESOLUTION seeking an opinion from the Court of Justice on the compatibility with the Treaties of the proposed Partnership Agreement between the European Union and its Member States, of the one part, and the Common Market of the South, the Argentine Republic, the Federative Republic of Brazil, the Republic of Paraguay and the Oriental Republic of Uruguay, of the other part, and the proposed Interim Agreement on Trade between the European Union, of the one part, and the Common Market of the South, the Argentine Republic, the Federative Republic of Brazil, the Republic of Paraguay and the Oriental Republic of Uruguay, of the other part",,0,,https://www.europarl.europa.eu/doceo/document/B-10-2026-0061_EN.html,
,B10-0060/2026,,"MOTION FOR A RESOLUTION seeking an opinion from the Court of Justice on the compatibility with the Treaties of the proposed Partnership Agreement between the European Union and its Member States, of the one part, and the Common Market of the South, the Argentine Republic, the Federative Republic of Brazil, the Republic of Paraguay and the Oriental Republic of Uruguay, of the other part, and the proposed Interim Agreement on Trade between the European Union, of the one part, and the Common Market of the South, the Argentine Republic, the Federative Republic of Brazil, the Republic of Paraguay and the Oriental Republic of Uruguay, of the other part",,0,,https://www.europarl.europa.eu/doceo/document/B-10-2026-0060_EN.html,
,A10-0266/2025,,"REPORT on addressing impunity through EU sanctions, including the EU Global Human Rights Sanctions Regime (so-called ‘EU Magnitsky Act’)",,0,,https://www.europarl.europa.eu/doceo/document/A-10-2025-0266_EN.html,
,A10-0248/2025,,RECOMMENDATION on the draft Council decision on the conclusion of the Agreement between the European Union and Bosnia and Herzegovina on operational activities carried out by the European Border and Coast Guard Agency in Bosnia and Herzegovina,,0,,https://www.europarl.europa.eu/doceo/document/A-10-2025-0248_EN.html,
,A10-0001/2026,,RECOMMENDATION FOR SECOND READING on the Council position at first reading with a view to the adoption of a Regulation of the European Parliament and of the Council amending Regulation (EC) No 261/2004 establishing common rules on compensation and assistance to passengers in the event of denied boarding and of cancellation or long delay of flights and Regulation (EC) No 2027/97 on air carrier liability in respect of the carriage of passengers and their baggage by air,,0,,https://www.europarl.europa.eu/doceo/document/A-10-2026-0001_EN.html,
,RC-B10-0070/2026,,JOINT MOTION FOR A RESOLUTION on the attempted takeover of Lithuania’s public broadcaster and the threat to democracy in Lithuania,,0,,https://www.europarl.europa.eu/doceo/document/RC-10-2026-0070_EN.html,
,A10-0107/2025,,REPORT on European technological sovereignty and digital infrastructure,,0,,https://www.europarl.europa.eu/doceo/document/A-10-2025-0107_EN.html,
,RC-B10-0071/2026,,JOINT MOTION FOR A RESOLUTION on the brutal repression against protesters in Iran,,0,,https://www.europarl.europa.eu/doceo/document/RC-10-2026-0071_EN.html,
,RC-B10-0064/2026,,"JOINT MOTION FOR A RESOLUTION on the presidential elections in Honduras, the non-recognition of the outcome by the incumbent administration and the attacks on opposition members of the National Assembly",,0,,https://www.europarl.europa.eu/doceo/document/RC-10-2026-0064_EN.html,
,A10-0268/2025,,REPORT on the choice of performance indicators for audit and budgetary control in the context of financing measures to support the implementation of future European competitiveness,,0,,https://www.europarl.europa.eu/doceo/document/A-10-2025-0268_EN.html,
,RC-B10-0068/2026,,JOINT MOTION FOR A RESOLUTION on the conviction and imminent sentencing of Jimmy Lai in Hong Kong,,0,,https://www.europarl.europa.eu/doceo/document/RC-10-2026-0068_EN.html,
,RC-B10-0066/2026,,JOINT MOTION FOR A RESOLUTION on the case of Joseph Figueira Martin in the Central African Republic,,0,,https://www.europarl.europa.eu/doceo/document/RC-10-2026-0066_EN.html,
